{"$id":"https://github.com/itdojp/private-match-protocol/raw/main/schema/pet-contract-compatibility.v0.3.schema.json","$schema":"https://json-schema.org/draft/2020-12/schema","additionalProperties":false,"properties":{"$schema":{"const":"https://github.com/itdojp/private-match-protocol/raw/main/schema/pet-contract-compatibility.v0.3.schema.json"},"artifact_status":{"const":"experimental"},"compatibility_digest":{"pattern":"^sha256:[0-9a-f]{64}$","type":"string"},"graphs":{"type":"array","minItems":3,"maxItems":3,"prefixItems":[{"additionalProperties":false,"properties":{"artifacts":{"items":{"additionalProperties":false,"properties":{"file_digest":{"pattern":"^sha256:[0-9a-f]{64}$","type":"string"},"path":{"pattern":"^(?!/)(?![A-Za-z]:)(?!.*\\\\)(?!.*(?:^|/)\\.\\.?(?:/|$))[A-Za-z0-9._/-]+$","type":"string"},"role":{"enum":["conformance-case-catalog","conformance-case-schema","error-code-catalog","error-code-schema","executable-result-schema","message-envelope-schema","operation-input-schema","operation-stage","operation-stage-schema","product-handoff","product-handoff-schema","profile-nitro","profile-schema","profile-secretflow","profile-voprf","protocol-binding","protocol-binding-schema","registry","registry-schema"],"type":"string"}},"required":["role","path","file_digest"],"type":"object"},"maxItems":19,"minItems":19,"type":"array"},"contract_version":{"const":"0.1"},"graph_digest":{"pattern":"^sha256:[0-9a-f]{64}$","type":"string"},"graph_id":{"const":"rollback-v0.1"},"selection":{"const":"rollback-only"}},"required":["graph_id","contract_version","selection","artifacts","graph_digest"],"type":"object"},{"additionalProperties":false,"properties":{"artifacts":{"items":{"additionalProperties":false,"properties":{"file_digest":{"pattern":"^sha256:[0-9a-f]{64}$","type":"string"},"path":{"pattern":"^(?!/)(?![A-Za-z]:)(?!.*\\\\)(?!.*(?:^|/)\\.\\.?(?:/|$))[A-Za-z0-9._/-]+$","type":"string"},"role":{"enum":["conformance-case-catalog","conformance-case-schema","error-code-catalog","error-code-schema","executable-result-schema","message-envelope-schema","operation-input-schema","operation-stage","operation-stage-schema","product-handoff","product-handoff-schema","profile-nitro","profile-schema","profile-secretflow","profile-voprf","protocol-binding","protocol-binding-schema","registry","registry-schema"],"type":"string"}},"required":["role","path","file_digest"],"type":"object"},"maxItems":19,"minItems":19,"type":"array"},"contract_version":{"const":"0.2"},"graph_digest":{"pattern":"^sha256:[0-9a-f]{64}$","type":"string"},"graph_id":{"const":"historical-v0.2"},"selection":{"const":"historical-only"}},"required":["graph_id","contract_version","selection","artifacts","graph_digest"],"type":"object"},{"additionalProperties":false,"properties":{"artifacts":{"items":{"additionalProperties":false,"properties":{"file_digest":{"pattern":"^sha256:[0-9a-f]{64}$","type":"string"},"path":{"pattern":"^(?!/)(?![A-Za-z]:)(?!.*\\\\)(?!.*(?:^|/)\\.\\.?(?:/|$))[A-Za-z0-9._/-]+$","type":"string"},"role":{"enum":["conformance-case-catalog","conformance-case-schema","error-code-catalog","error-code-schema","executable-result-schema","message-envelope-schema","operation-input-schema","operation-stage","operation-stage-schema","product-handoff","product-handoff-schema","profile-nitro","profile-schema","profile-secretflow","profile-voprf","protocol-binding","protocol-binding-schema","public-result-field-policy","public-result-field-policy-schema","registry","registry-schema"],"type":"string"}},"required":["role","path","file_digest"],"type":"object"},"maxItems":21,"minItems":21,"type":"array"},"contract_version":{"const":"0.3"},"graph_digest":{"pattern":"^sha256:[0-9a-f]{64}$","type":"string"},"graph_id":{"const":"current-v0.3"},"selection":{"const":"current"}},"required":["graph_id","contract_version","selection","artifacts","graph_digest"],"type":"object"}],"items":false},"limitations":{"items":{"maxLength":2048,"minLength":1,"type":"string"},"maxItems":16,"minItems":1,"type":"array","uniqueItems":true},"record_type":{"const":"pet-contract-compatibility"},"rules":{"type":"object","additionalProperties":false,"properties":{"cross_version_mixing":{"const":"fail-closed"},"implicit_fallback":{"const":false},"forward_inference":{"const":false},"partial_graph":{"const":"fail-closed"},"rollback_selection":{"const":"complete-v0.1-graph-only"},"historical_selection":{"const":"complete-v0.2-graph-explicit-only"},"current_selection":{"const":"complete-v0.3-graph-only"},"corrected_versions_not_current":{"const":["0.1","0.2"]},"v02_acknowledgment_evidence_in_v03":{"const":"fail-closed"},"shared_profile_authority":{"const":"exact-v0.2-bytes-under-v0.3-wrapper"}},"required":["cross_version_mixing","implicit_fallback","forward_inference","partial_graph","rollback_selection","historical_selection","current_selection","corrected_versions_not_current","v02_acknowledgment_evidence_in_v03","shared_profile_authority"]},"schema_version":{"const":"0.3"},"version_requirements":{"type":"array","minItems":3,"maxItems":3,"prefixItems":[{"additionalProperties":false,"properties":{"contract_version":{"const":"0.1"},"error_code_catalog_path":{"const":"config/pet-profile-error-codes.v0.1.json","type":"string"},"operation_input_schema_path":{"const":"schema/pet-profile-operation-input.v0.1.schema.json","type":"string"},"operation_stage_path":{"const":"specs/pet-integration/operation-stage-contract.v0.1.yaml","type":"string"},"product_handoff_path":{"const":"handoff/product-decision-engine-port.v0.1.yaml","type":"string"},"profile_registry_path":{"const":"registry/pet-integration-profiles.v0.1.yaml","type":"string"},"protocol_binding_path":{"const":"specs/pet-integration/protocol-binding.v0.1.yaml","type":"string"},"selection":{"const":"rollback-only"}},"required":["contract_version","selection","profile_registry_path","protocol_binding_path","operation_stage_path","operation_input_schema_path","product_handoff_path","error_code_catalog_path"],"type":"object"},{"additionalProperties":false,"properties":{"contract_version":{"const":"0.2"},"error_code_catalog_path":{"const":"config/pet-profile-error-codes.v0.2.json","type":"string"},"operation_input_schema_path":{"const":"schema/pet-profile-operation-input.v0.2.schema.json","type":"string"},"operation_stage_path":{"const":"specs/pet-integration/operation-stage-contract.v0.2.yaml","type":"string"},"product_handoff_path":{"const":"handoff/product-decision-engine-port.v0.2.yaml","type":"string"},"profile_registry_path":{"const":"registry/pet-integration-profiles.v0.2.yaml","type":"string"},"protocol_binding_path":{"const":"specs/pet-integration/protocol-binding.v0.2.yaml","type":"string"},"selection":{"const":"historical-only"}},"required":["contract_version","selection","profile_registry_path","protocol_binding_path","operation_stage_path","operation_input_schema_path","product_handoff_path","error_code_catalog_path"],"type":"object"},{"additionalProperties":false,"properties":{"contract_version":{"const":"0.3"},"error_code_catalog_path":{"const":"config/pet-profile-error-codes.v0.3.json","type":"string"},"operation_input_schema_path":{"const":"schema/pet-profile-operation-input.v0.3.schema.json","type":"string"},"operation_stage_path":{"const":"specs/pet-integration/operation-stage-contract.v0.3.yaml","type":"string"},"product_handoff_path":{"const":"handoff/product-decision-engine-port.v0.3.yaml","type":"string"},"profile_registry_path":{"const":"registry/pet-integration-profiles.v0.3.yaml","type":"string"},"protocol_binding_path":{"const":"specs/pet-integration/protocol-binding.v0.3.yaml","type":"string"},"selection":{"const":"current"},"public_result_field_policy_path":{"const":"config/pet-public-result-field-policy.v0.3.json","type":"string"},"profile_contract_version":{"const":"0.2"}},"required":["contract_version","selection","profile_registry_path","protocol_binding_path","operation_stage_path","operation_input_schema_path","product_handoff_path","error_code_catalog_path","public_result_field_policy_path","profile_contract_version"],"type":"object"}],"items":false}},"required":["$schema","schema_version","record_type","artifact_status","graphs","rules","limitations","compatibility_digest","version_requirements"],"title":"PET contract version compatibility map","type":"object"}
